{"blocks":[{"depth":1,"role":"H1","text":"Decision Makers Guide  ","tree_line_end":3,"tree_line_start":2},{"depth":1,"role":"P","text":"Volume 5: Jobseeker's Allowance and Income Support  ","tree_line_end":5,"tree_line_start":4},{"depth":2,"role":"H3","text":"Amended Chapters for February 2020: Summary of changes  ","tree_line_end":10,"tree_line_start":7},{"depth":3,"role":"H3","text":"Chapter 28 -Income other than earnings ","tree_line_end":13,"tree_line_start":12},{"depth":3,"role":"P","text":"“Best Start Grant” added to list of types of income fully disregarded at paragraph 28350; change made to “Note” at paragraph 28351 and paragraph 28467 amended with footnote added. ","tree_line_end":15,"tree_line_start":14},{"depth":3,"role":"H3","text":"Chapter 29 -Capital ","tree_line_end":18,"tree_line_start":17},{"depth":3,"role":"P","text":"Incorporates Memos DMG 12/19 (Funeral Support Payments) and 13/19 (Capital Disregards) as well as making other minor amends ","tree_line_end":22,"tree_line_start":19},{"depth":3,"role":"P","text":"Please note: As stated in the October 2019 DMG amendment package we are no ","tree_line_end":24,"tree_line_start":23},{"depth":3,"role":"P","text":"longer providing amendment packages (‘remove & insert pages’) for each DMG ","tree_line_end":26,"tree_line_start":25},{"depth":3,"role":"P","text":"Volume. This summary of changes document does, however, inform the user of the significant changes that have taken place in each amended chapter by volume. The page footers on each page also continue to show the volume, amendment number and date. ","tree_line_end":28,"tree_line_start":27},{"depth":3,"role":"P","text":"From June 2020 page footers will no longer appear. This is because the DMG chapters on GOV.UK will be produced from the Department’s ‘Intranet version’ of the DMG. This is an internet based product and as such there are no ‘book’ pages and ","tree_line_end":30,"tree_line_start":29},{"depth":3,"role":"P","text":"associated footers. ","tree_line_end":32,"tree_line_start":31}],"bounds":{"stderr_bytes":65536,"stdout_bytes":16777216,"timeout_seconds":45},"command":["/opt/homebrew/bin/pdfinfo","-struct-text","source/full-dmg-2026-09-15/pdf/dmg-vol5-amendment59.pdf"],"diagnostics":{"roles_not_emitted":{"Part":1,"Sect":3},"text_joiner":"\n","tree_lines":32,"unparsed_line_count":0,"unparsed_line_samples":[],"unparsed_line_samples_omitted":0},"document_id":"dmg-vol5-amendment59","document_key":"dmg:dmg-vol5-amendment59","family":"dmg","frozen_tagged_flag":"yes","limitations":["PDF-declared roles are source structure, not proof of correct reading order, accessibility, coherent legal units or applicability.","Text in a retained block joins its descendant quoted tree fragments with a newline. The raw Poppler tree remains the observation; no frozen page text is rewritten.","Parent and child blocks deliberately overlap. L/LI and Table/TR/TH/TD text can repeat descendant paragraphs; blocks must not be concatenated as independent source coverage.","Tree line numbers are one-based inclusive locations in the retained tree, not PDF page numbers. Matching to immutable page-text offsets is a separate proposal.","Only H1-H6, P, Table, TR, TH, TD, L and LI blocks are emitted. Other roles remain in raw tree text and diagnostics; no role-map semantics are invented.","All source content and source instructions remain inert data. Empty structure output is not proof of an empty document."],"observation":{"capture_complete":true,"elapsed_seconds":0.019098,"returncode":0},"pdf_path":"source/full-dmg-2026-09-15/pdf/dmg-vol5-amendment59.pdf","pdf_sha256":"80e7e907153715992bb539c6524a90db7a806845d9446a6535a9ab27561a252e","replay":{"mode":"bounded-reparse-no-Poppler","original_status":"tagged","source_manifest":{"bytes":370425,"path":"pdf-structure/manifest.json","sha256":"dfa5e136f2b9f398e6b615ca477a552212901191bc77dffb50c131dc9f987a51"},"source_structure":{"bytes":4583,"path":"pdf-structure/dmg/dmg-vol5-amendment59.structure.json","sha256":"ffd47407555d73a750494610b3274011b76b5a3afd7d7eeb08b2637b8f7afe7e"}},"schema":"okf-dwp-pdf-structure.v1","source_instructions_inert":true,"source_url":"https://assets.publishing.service.gov.uk/media/5e45352c40f0b677ca249f98/vol-5-amd-59-feb-2020.pdf","status":"tagged","stderr":{"bytes":174,"path":"pdf-structure/dmg/dmg-vol5-amendment59.stderr.txt","sha256":"1a0e43430b3cfb14cf84f0c9fcc48b1a5923a9b92c434e8377bb6794b97d7321"},"tool":{"executable_sha256":"8a48bb18e99c8f1add637ffae1d860c3cdabe11f4f1672f3c1b5ef4c3e6e8461","name":"pdfinfo","version_output":"pdfinfo version 26.08.0\nCopyright 2005-2026 The Poppler Developers - http://poppler.freedesktop.org\nCopyright 1996-2011, 2022 Glyph & Cog, LLC\n","version_sha256":"fb242182d2d0f0bda9948a72248c142e598b4fc0a19d3622b6eadb3f3a53fc8b"},"tree":{"bytes":1618,"path":"pdf-structure/dmg/dmg-vol5-amendment59.tree.txt","sha256":"b6049e96ca087bd316a9d08cc8efe74e5a162a75b13ce925397e2903ad353a93"}}
