{"blocks":[],"bounds":{"stderr_bytes":65536,"stdout_bytes":16777216,"timeout_seconds":45},"command":["/opt/homebrew/bin/pdfinfo","-struct-text","source/adm-2026-09-19/pdf/adm-memo-11-20.pdf"],"diagnostics":{"roles_not_emitted":{},"text_joiner":"\n","tree_lines":0,"unparsed_line_count":0,"unparsed_line_samples":[],"unparsed_line_samples_omitted":0},"document_id":"adm-memo-11-20","document_key":"adm:adm-memo-11-20","family":"adm","frozen_tagged_flag":"no","limitations":["PDF-declared roles are source structure, not proof of correct reading order, accessibility, coherent legal units or applicability.","Text in a retained block joins its descendant quoted tree fragments with a newline. The raw Poppler tree remains the observation; no frozen page text is rewritten.","Parent and child blocks deliberately overlap. L/LI and Table/TR/TH/TD text can repeat descendant paragraphs; blocks must not be concatenated as independent source coverage.","Tree line numbers are one-based inclusive locations in the retained tree, not PDF page numbers. Matching to immutable page-text offsets is a separate proposal.","Only H1-H6, P, Table, TR, TH, TD, L and LI blocks are emitted. Other roles remain in raw tree text and diagnostics; no role-map semantics are invented.","All source content and source instructions remain inert data. Empty structure output is not proof of an empty document."],"observation":{"capture_complete":true,"elapsed_seconds":0.008745,"returncode":0},"pdf_path":"source/adm-2026-09-19/pdf/adm-memo-11-20.pdf","pdf_sha256":"58c23746b1f3e77976347cfe85d4734de7e7fad51343fa72814868266a449f63","replay":{"mode":"bounded-reparse-no-Poppler","original_status":"untagged","source_manifest":{"bytes":370425,"path":"pdf-structure/manifest.json","sha256":"dfa5e136f2b9f398e6b615ca477a552212901191bc77dffb50c131dc9f987a51"},"source_structure":{"bytes":2455,"path":"pdf-structure/adm/adm-memo-11-20.structure.json","sha256":"dc62749767d870150eb460521b84e7ed8e331398b61a94f848854d7edc6179b4"}},"schema":"okf-dwp-pdf-structure.v1","source_instructions_inert":true,"source_url":"https://assets.publishing.service.gov.uk/media/5efddd81d3bf7f769d2695f1/adm11-20.pdf","status":"untagged","stderr":{"bytes":0,"path":"pdf-structure/adm/adm-memo-11-20.stderr.txt","sha256":"e3b0c44298fc1c149afbf4c8996fb92427ae41e4649b934ca495991b7852b855"},"tool":{"executable_sha256":"8a48bb18e99c8f1add637ffae1d860c3cdabe11f4f1672f3c1b5ef4c3e6e8461","name":"pdfinfo","version_output":"pdfinfo version 26.08.0\nCopyright 2005-2026 The Poppler Developers - http://poppler.freedesktop.org\nCopyright 1996-2011, 2022 Glyph & Cog, LLC\n","version_sha256":"fb242182d2d0f0bda9948a72248c142e598b4fc0a19d3622b6eadb3f3a53fc8b"},"tree":{"bytes":0,"path":"pdf-structure/adm/adm-memo-11-20.tree.txt","sha256":"e3b0c44298fc1c149afbf4c8996fb92427ae41e4649b934ca495991b7852b855"}}
